	eng	kor
541	Why is he staring at me?	그는 왜 날 쳐다보는 거지?
1665	Have you ever been in Australia before?	호주에 가본 적 있어?
3527	Why does Tom hate Boston so much?	왜 톰은 보스턴을 그렇게나 싫어해?
62	Tom gave Mary some advice on how to pass multiple-choice tests.	탐은 메리에게 선다형 시험에 통과하는 방법에 대해 조언했다.
1438	I'm sorry, I can't help you.	미안한데, 내가 도와줄 수가 없어.
666	Tom is living in the apartment that I used to live in.	톰은 내가 한때 살았던 아파트에 살고 있어.
3091	Tom is a decent human being.	톰은 제대로 된 인간이야.
2996	I never should've borrowed money from Tom.	난 톰한테 돈을 절대 빌리지 말았어야 했는데.
2908	Tom looks pretty sleepy.	톰은 상당히 졸려 보인다.
1156	Are you doing what you want to do?	네가 하고 싶은 걸 하고 있어?
3180	The cat prefers fish to meat.	고양이는 고기보다 생선을 선호해.
1469	Tom doesn't know what he'll do.	톰은 그가 뭘 해야 할지 모른다.
2490	How much time will it take to do this?	이걸 하려면 시간이 얼마나 걸려?
1635	Tom is tall for his age.	톰은 나이에 비해 키가 커.
2979	He attributes his success to hard work.	그는 그의 성공을 그가 열심히 일한것에 대해 공을 돌렸다
1568	Many people act like that.	많은 사람들이 저런 식으로 행동해.
2444	Tom didn't seem to be so busy.	톰 별로 안 바빠 보이던데.
890	I may be too old.	난 너무 늙었을지도 몰라.
2791	If walls could talk, what stories would they tell us?	만약 벽이 말을 할 수 있다면, 그 벽이 어떤 이야기를 하게 될까?
1	Tom prevented Mary from doing that.	톰은 메리가 그걸 못 하도록 막았어.
257	I'm way stronger than I used to be.	나는 예전의 나보다 훨씬 강해.
686	All I can do is to do my best.	내가 할 수 있는 건 최선을 다하는 것 뿐이야.
474	This could hurt our business.	이것은 우리 사업을 다치게 할 수도 있다.
2571	Are there any girls here that you haven't yet met?	네가 아직 만난 적 없는 여자애들도 여기 있어?
519	Where am I supposed to sleep?	내가 어디서 자기로 되어 있어?
150	I know a good lawyer who can help you.	당신을 도와줄 수 있는 괜찮은 변호사를 알고 있습니다.
3735	Tom wanted a bigger discount.	톰은 더 할인해 주기를 원했다.
3598	Food and water are extremely limited.	음식과 물이 극히 제한되어 있어.
2199	Tom is bedridden now.	톰은 지금 아파서 누워 있어.
3740	Lack of sleep is bad for the body.	수면 부족은 몸에 나빠.
3771	Tom isn't likely to pass the driving test.	톰은 운전면허 시험에 떨어질 듯 하다.
3817	Tom seemed a little dangerous.	톰은 조금 위험해 보였어.
3488	Don't try to talk. Save your energy.	말하려 하지마. 차라리 에너지를 아껴.
141	Five times five is twenty-five.	오 곱하기 오는 이십오야.
1914	Tom and Mary do as they're told.	톰이랑 메리는 자기들이 말한 대로 하고 있어.
3213	I doubt Tom can do that without some help.	톰이 도움 없이 그걸 잘 해낼 수 있을지 모르겠다.
774	I knew that Tom didn't want to do that again.	난 톰이 저걸 다시는 하기 싫어한다는 걸 알고 있었어.
2886	Weather permitting, we'll start on our trip tomorrow.	날씨가 허락한다면, 우리는 내일 여행을 시작할 것이다.
746	I told Tom not to use those.	난 톰한테 그걸 쓰지 말라고 했는데.
3090	I shouldn't've told you.	너한테 말하지 말았어야 했어.
1890	I wish I'd married another man.	다른 남자와 결혼했다면 좋았을 텐데.
1153	Would you be happier with Tom?	톰과 함께라면 더 행복해질 것 같니?
82	Is there anything you want to tell me?	뭔가 하고 싶은 얘기 없어?
3515	Actually, we don't have a choice.	사실상 우리는 다른 방법이 없다
2013	They speak to each other in French.	그 사람들은 서로 프랑스어로 말해.
513	Tom was diagnosed with autism when he was three years old.	톰은 세살때 자폐즘으로 진단받았어.
2297	We solved that problem in a week.	우리는 그 문제를 일주일 안에 해결했다.
771	Have you ever been hit by a car?	너 차에 치인 적 있어?
1180	He is the dumbest kid in the class.	그는 학급에서 가장 둔한 아이이다.
421	Marriage is the union of a man and woman.	남녀간의 결합을 결혼이라고 하지.
3159	Tom said he was very lonely.	톰이 무척 외로웠다고 말했어.
2982	I'm not going to let you commit suicide.	난 네가 자살하게 내버려 두지 않을 거야.
766	He has an air of mystery about him.	그 사람은 정체불명의 기운을 가지고 있어.
3136	Tom told us not to make any noise.	소음을 내지 말라고 톰이 우리한테 말했어.
3640	I don't want to waste time on this problem.	이런 일에 시간을 낭비하고 싶지 않다.
3495	Tom said he'd be very surprised if Mary didn't win the tournament.	톰은 메리가 토너먼트에서 이기지 못한다면 깜짝 놀랄 것이라고 말했다.
818	Tom has more money than me.	톰은 나보다 돈이 많아.
3054	Have you ever been in jail?	너 감옥에 간 적 있어?
3732	I don't know who started the rumor.	누가 소문을 내기 시작했는지 난 몰라.
3346	I think French is the most beautiful language in the world.	프랑스어는 세상에서 가장 아름다운 언어인 것 같아.
878	You won't believe who came by today.	넌 오늘 누가 왔었는지 못 믿을걸.
2753	Well, you obviously have romantic feelings for Tom.	흠, 너는 확실히 톰에게 연애감정을 가지고 있군.
1104	You can't keep this a secret.	너는 이걸 비밀로 할 수는 없어.
2969	Tom sat in the darkness.	톰은 어둠 속에 앉아 있었어.
1992	You look tired, so you should go to bed early.	피곤해 보이니까 일찍 자는 것이 좋겠다.
3406	I must've lost some weight.	난 아마 살이 좀 빠졌어.
907	I made a really big sandwich for Tom.	난 톰을 위해서 아주 큰 샌드위치를 만들었어.
710	Tom learned French in school.	톰은 학교에서 프랑스어를 배워.
2591	Tom is very tall for his age.	톰은 나이에 비해 키가 매우 커.
1779	I wish I could fly.	내가 날 수 있다면 좋을 텐데.
1210	Two American students live in this dorm.	이 기숙사에는 미국인 학생 두 명이 살고 있다.
2506	He has absolutely no respect for other people's feelings.	그는 타인의 기분은 전혀 존중하지 않는다.
2825	My favorite subject is science.	내가 가장 좋아하는 과목은 과학이야.
738	I don't want to study medicine.	난 의학을 공부하고 싶지 않아.
3242	I met an old friend by chance.	우연히 옛날 친구를 만났어.
1930	I often borrow books from the library.	나는 도서관에서 종종 책을 빌린다.
1609	Tom was wearing a ridiculous hat.	톰은 멍청한 모자를 쓰고 있었어.
1597	Children and drunks don't lie.	아이와 술취한 사람은 거짓말 하지 않는다.
1288	Would you stop doing that?	그것 좀 멈춰 줄래?
289	My son is small for his age.	내 아들은 또래에 비해 키가 작아.
964	Do you like baking cakes?	케이크 굽는 거 좋아해?
2381	I thought Tom would never see you again.	톰이 날 이제 더 이상 날 안 볼 줄 알았어.
789	He breathed deeply before entering his boss's office.	그는 상사의 사무실로 들어가기 전에 심호흡을 했다.
2114	There's so much I don't understand.	내가 이해하지 못하는 것이 너무 많아
2202	Tom turned off his computer.	톰은 자기 컴퓨터를 껐어.
2909	Tom is a pioneer in this field.	톰은 이 분야의 선구자야.
367	Tom has spent the past three years in prison.	톰은 과거 삼 년동안 감옥에 있었어.
1131	Can I borrow your umbrella?	네 우산 좀 빌려 줄래?
868	Do you really think you can convince Tom to do that?	너 정말 톰이 그걸 하도록 설득할 수 있다고 생각해?
343	Is there anything that you want to tell me?	뭔가 하고 싶은 얘기 없어?
1649	Our baby can't talk yet.	우리 아기는 아직 말을 못해.
1139	I hope that we don't have to wait for too long.	많이 안 기다려도 되면 좋겠다
2422	She suffers from low blood pressure.	그 사람은 저혈압에 시달리고 있어.
180	Tom was acting weird.	톰은 이상하게 굴고 있었어.
1646	You're persistent, aren't you?	넌 끈질긴 사람이야, 맞지?
1864	I don't want to suffer.	나는 고통받고 싶지 않아.
3202	I couldn't come to the birthday party.	난 생일 파티에 못 갔어.
2489	Tom was afraid to be here.	톰이 여기에 있길 무서워 했어.
785	My work is not as easy as yours.	내가 하는 일은 네가 하는 것처럼 쉽지 않아.
1014	Sugar is soluble in water.	설탕은 물에 잘 녹아.
3507	He has a deep insight into human psychology.	그 사람은 인간 심리에 높은 식견이 있어.
1648	I don't want to celebrate my birthday.	난 내 생일을 축하하고 싶지 않다.
3806	I think it's hilarious.	정말 웃긴 것 같아.
2906	Tom thinks Mary can understand French.	톰은 메리가 프랑스어를 이해하는 줄 알아.
3765	Tom doesn't have to go to Australia next week.	톰은 다음 주 호주에 가지 않아도 돼.
2884	My English teacher recommended that I read these books.	나의 영어 선생님이 나에게 그 책을 읽으라고 추천하셨다.
1643	I did nothing wrong.	난 잘못한 거 없어.
1158	To be honest with you, I don't think I can do that.	솔칙히 말하면 나는 내가 할 수 있을거란 자신이 없어.
45	I think that French is the most beautiful language in the world.	프랑스어는 세상에서 가장 아름다운 언어인 것 같아.
2638	How long will you be staying there?	거기서 얼마나 기다리고 있을 거야?
2010	Having been convicted of murder, he was sentenced to life imprisonment.	그는 살인죄로 종신형을 선고 받았다.
1175	Tom wants to avoid everything.	톰은 모든 것을 회피하고 싶어해.
1833	Tom is eating potato chips.	톰은 감자칩을 먹고 있어.
3745	I think I can speak French well enough to say pretty much anything I want to say.	나는 내가 말하고 싶은 것은 거의 다 말할 수 있을 정도로 불어를 잘 한다고 생각한다.
2962	Ebola spreads from person to person through bodily fluids.	에볼라는 체액을 통하여 사람에서 사람으로 전파된다.
3671	We had a good time yesterday.	우리는 어제 즐겁게 지냈다.
293	Tom and Mary became very good friends.	톰과 메리는 아주 좋은 친구가 되었다더라.
2869	Could you tell me what that means?	그게 뭘 의미하는 건지 말해줄 수 있을까?
1440	Let's see if we can get inside.	우리가 안으로 들어갈 수 있는지 보자.
2643	You and I have a lot in common.	우리 둘은 공통점이 많네.
200	Don't pry into my private life.	내 사생활은 묻지 말아줘.
1408	Have you ever been engaged?	한번이라도 약혼한 적 있어?
384	Tom still hasn't responded to my email.	톰이 아직도 내 이메일에 답장을 안했어.
2060	We need to review the case.	우리는 그 사건을 검토할 필요가 있다.
1066	That happened over a year ago.	그 일은 일년 전 쯤 일어났다.
3078	She is always at the bottom of the class.	걔는 항상 반에서 꼴찌야.
1935	A dog was following Tom.	개 한 마리가 톰을 따라가고 있었어.
2843	A cute girl caught Tom's eye.	귀여운 여자애가 톰의 눈길을 사로잡았어.
2951	Tom laughed so hard he cried.	톰은 눈물이 날 정도로 웃었어.
2699	This house is not for sale.	이 집은 팔려고 내놓은 집 아니에요.
2278	Remember that we're all in the same boat.	우리 모두가 같은 한 배를 탔다는 걸 기억해라.
1989	Have you studied Darwin's theory of evolution?	다윈의 진화이론을 공부해본 적 있어?
2937	I asked Tom why he wanted to study French.	나는 톰에게 왜 프랑스어를 배우고자했는지 물어봤다.
3685	I thought that you'd forgotten.	네가 잊어버린 건 줄 알았어.
2448	Tom has braided his beard.	톰은 그의 턱수염을 땋았다.
624	He hid himself behind a large rock.	그는 큰 바위 뒤에 숨었다.
994	What's your cat's name?	네 고양이의 이름은 뭐야?
2230	Don't act like you're so innocent.	너 그렇게 순수한 척 하지 마.
3049	Why are you walking so fast?	왜 그렇게 빨리 걸어?
536	Under a microscope, some viruses appear quite beautiful.	현미경 아래에선 몇몇 바이러스는 꽤 아름다워 보여.
672	Why don't you leave me alone?	날 좀 가만히 내버려 둬.
154	I can assure you we'll never make that mistake again.	단언컨대, 우린 절대 그런 실수를 하지 않을 거야.
2401	I have to take the entrance exams next year.	나 내년에 입학시험을 봐야 돼.
1122	Actinium melts at 1,051°C.	악티늄은 1,050°C일 때 녹아.
2285	Do you think we could do that?	우리가 그걸 할 수 있다 생각해?
1017	She looked around the room.	그 사람은 방 주위을 둘러 봤어.
3066	Is there a pharmacy nearby?	이 근처에 약국 있어요?
2076	I didn't want to appear weak.	약해 보이고 싶지 않았어.
3483	My ideas are different from yours.	내 생각은 너와 달라.
3348	Tom and Mary have children.	톰과 메리에게는 자식이 있어.
2885	I'd like to reserve a table for two.	두 명 자리를 예약하고 싶어요.
2335	I have a hard time remembering things.	나는 여러가지를 기억하는 게 힘들어.
2037	I don't lie.	나는 거짓말 하지 않습니다.
1341	Have you ever been to a foreign country?	외국에 나가본 적 있어?
1912	It happened prior to my arrival.	그 일은 내가 도착하기 전에 일어났어.
3836	Tom sees this in a different way.	톰은 이것을 다른 방식으로 본다.
2659	Nothing could sway his conviction.	그 어떤 것도 그의 신념을 꺾을 수 없었다.
3217	I never should've gotten divorced.	난 절대 이혼하지 말았어야 했는데.
1913	I don't really want to learn French.	나는 프랑스어를 진짜 배우고 싶지 않아.
1077	I can't walk fast.	난 빠른 걸음을 할 수 없어.
49	I should've come with you.	너랑 같이 갔어야 했는데.
1429	We graduate from high school at eighteen.	우리는 18살에 고등학교를 졸업합니다.
1128	I love my home.	난 내 집이 좋아.
1565	Tell me what's going on.	무슨 일인지 얘기해 주세요.
2709	I was trying to help you.	난 널 도와주려고 노력하던 중이었어.
1950	I have to give this book to Tom.	톰에게 이 책을 줘야 합니다.
1772	There's no other way to do this.	그걸 하는 데에는 다른 방법이 없어.
1121	Her dress attracted everyone's attention at the party.	그 여자가 파티에 입고 온 드레스가 사람들의 눈길을 끌었지.
392	Is it true that you're a high school teacher?	네가 고등학교 선생님이라는 게 사실이니?
2646	You haven't ever been to Boston, have you?	너 보스턴에 가본 적 없지?
3120	I watched TV after I washed the dishes.	설거지 끝내고 티비 봤어.
3021	I really wanted to help.	난 정말로 돕고 싶었어.
1976	Are you able to play organ?	너 오르간 칠 수 있어?
1898	Most people think I'm crazy.	대부분의 사람들은 내가 미쳤다고 생각해
3370	Tom eats meat, but Mary doesn't.	톰은 마리와는 달리 고기를 먹을 수 있어.
1825	Tom is wearing a blue coat.	톰은 파란색 코트를 입고 있어.
252	Tom is better at French than I am.	톰이 나보다 프랑스어 잘해.
3289	Tom is a very bad person.	톰은 아주 나쁜 사람이야.
3342	She doesn't love me anymore.	그 사람은 나를 더 이상 사랑하지 않아.
940	I want to go to sleep.	나 자러 가고 싶어.
1062	Have you ever dreamed of me?	내 꿈 꿔본 적 있어?
654	I'll stay here till you get back.	나는 네가 돌아올 때까지 여기에 있을 것이다.
179	Tom kicked the ball really hard.	톰은 정말 세게 공을 찼다.
336	Tom has no idea where Mary is.	톰은 메리가 어디 있는지 모른다.
2644	Tom made me a cake.	톰이 날 위해 케이크를 만들었어.
1492	Tom and I first met in 2013.	나랑 톰은 2013년도에 처음 만났어.
2207	Tom wore jeans and a cowboy hat.	톰은 청바지를 입고 카우보이 모자를 썼어.
3309	You need to drink more water.	너 물 좀 더 마셔야 겠어.
2106	Things are the same, but people have changed.	상황은 같지만 사람들은 바뀌었다.
2551	I've learned a lot from Tom.	난 톰한테서 많은 걸 배웠어.
2090	I can't imagine a day without you.	네가 없는 날이란 상상도 못 하겠어.
1763	Tom has been crying every night.	톰은 매일 밤마다 울어댔다.
2261	You haven't told Tom you're married, have you?	너 결혼한거 톰한테 말 안했구나, 그치?
3013	Do you remember how slow the Internet used to be?	한때 인터넷이 얼마나 느렸었는지 기억해?
523	Rabbits are extremely social animals.	토끼는 극히 사교적인 동물이야.
2620	This car looks pretty cool.	이 차가 엄청 멋있어 보인다.
2767	I'm very happy in Boston.	난 보스턴 생활이 너무 좋아.
1308	Learning languages is interesting.	언어를 배우는 것은 재미있다.
2619	Her jokes made us all laugh.	그 사람의 농담은 우리 모두를 웃게 했었어.
832	Tom said he spoke to Mary yesterday.	톰이 말하길 자기가 어제 마리한테 말을 걸었대.
2179	People who ignore history tend to repeat it.	역사를 무시하는 사람들은 역사를 되풀이하게 된다.
1403	Some people believe in God and others don't.	신을 믿는 사람들도 있고 아닌 사람도 있어.
846	This news is important to us.	이 뉴스는 우리에게 중요하다.
2703	I will never forgive you.	난 널 절대로 용서하지 않을 거야.
15	This English book is too difficult for me to read.	이 영어 책은 내가 읽기엔 너무 어렵다.
3811	I prefer quality to quantity.	나는 양보다 질을 선호해.
3429	Tom is in a very good mood.	톰은 기분이 굉장히 좋네.
3197	I often dream in French.	나는 종종 프랑스어로 꿈을 꿔.
366	You took the words right out of my mouth.	바로 그게 내가 하고 싶은 말이었다.
1843	His dream came true.	그 사람의 꿈은 실현되었어.
616	All that glitters is not gold.	반짝이는 것이 모두 금은 아니다.
2760	Tom washes his hands more than thirty times a day.	톰은 하루에 삼십 번 이상 손을 씻어.
932	We don't know anything about Tom's past.	우린 톰의 과거에 대해 아무것도 몰라.
1374	That's what makes me sad.	그게 바로 날 슬프게 해.
2141	I feel like doing that today.	오늘 이걸 하고 싶은 기분이야.
3273	I read a French book.	난 프랑스 책을 읽었어.
243	Men like to look masculine.	남자들은 남성적으로 보이고 싶어한다.
3754	I know what Tom is doing.	나는 톰이 뭘 하는지 안다.
3851	Tom pulled out an old shoebox from his closet and opened it.	톰은 벽장에서 헌 구두상자를 꺼내 열었다.
278	I can't decode the message.	메시지를 해독할 수 없어.
1405	I'm the only person who did that.	내가 그걸 한 유일한 사람이야.
1579	I'm in my room studying French.	나는 방에서 프랑스어 공부하는 중이야.
2136	Tom liked to listen to Mary play the piano.	톰은 메리가 피아노 치는 것을 듣는 것을 좋아했다.
303	Is there something that you wish to tell me?	뭔가 할 말이 있니?
1863	Tom is still quite young.	톰은 아직도 꽤 어려.
1631	Tom started getting angry.	톰은 화가 나기 시작했다.
2532	Tom wondered why there was a dog in his house.	톰은 왜 자기 집에 개가 있었는지 알고 싶었다.
1419	I can't describe my sadness.	나의 슬픔을 뭐라 표현할 수가 없네.
603	Always cite your sources.	항상 네 자료를 인용하도록 해.
2036	What happened to all those people?	저기 단체로 무슨 일이야?
3535	Tom's explanation was too complex.	톰은 너무 복잡하게 설명해.
1130	Don't say something you'll regret later.	네가 나중에 후회할 만한 말은 하지마.
3236	This is a very useful tool.	이건 아주 유용한 도구야.
3460	I'm quite happy here.	난 여기 꽤 만족스러워.
1238	Since there is no air on the moon, there is no sound at all.	달에는 공기가 없으니까 소리도 전혀 없어.
3610	I've never played tennis with Tom.	난 톰이랑 테니스 쳐 본 적이 없어.
992	I think this is Tom's house.	이건 톰의 집인 것 같아.
602	I'm beginning to forget my French.	난 프랑스어를 잊어버리기 시작했어.
3005	I don't want Tom to move to Boston.	나는 톰이 보스턴으로 이사하는 것을 원하지 않아.
2806	I want to learn to defend myself.	나는 내 자신을 방어하는 법을 배우고 싶어.
294	Tom was the one who wrote this story.	톰이 이 이야기를 쓴 사람이었어.
3266	I love this school.	난 이 학교를 좋아해.
3814	I shouldn't've eaten that.	난 그걸 먹지 말았어야 했어.
1020	I intend to decline his offer to help me.	날 도와주겠다는 그의 제안은 거절할 생각이다.
74	Tom sat two rows ahead of me.	탐은 나보다 2줄 앞에 앉았다.
2361	Don't lie. Be honest.	거짓말 하지 말고, 솔직해져 봐.
1114	I saw him reading a book.	나는 그 사람이 책을 읽는 걸 봤어.
2080	Tom wondered what Mary wanted to do.	톰이 메리가 뭘 원하는지 굼금해하더라.
329	We never should've gone to Australia.	우린 절대 호주에 가지 말았어야 했는데.
491	Tom is working as a software engineer.	톰은 소프트웨어 기술자로서 일하고 있어.
777	We can buy it.	이건 우리가 살 수 있어.
1357	I think that Tom knows something.	톰이 뭔가를 알고 있는 것 같아.
743	Tom is a very dedicated actor.	톰은 아주 헌신적인 배우야.
2883	I'm too old to wear something like that.	난 저런 옷을 입기엔 너무 늙었어.
1398	Tom doesn't look so well.	탐은 그다지 좋아보이지 않는다.
2154	I should've cooked the pork longer.	돼지고기를 더 구웠어야 했는데.
945	I'm extremely shy.	난 극히 낯을 가려.
1617	I've had a thing for rabbits ever since.	나는 그때부터 토끼에게 끌리기 시작했다.
205	Tom will be there to meet you.	톰이 너를 만나러 거기에 갈 거야.
1495	I was quite lucky.	난 꽤 운이 좋았었어.
831	Tom came back home after dark.	톰은 어두워진 후에 집에 돌아왔어.
8	I have to ask Tom a question.	톰에게 물어볼 것이 있습니다.
546	Tom's only been a widower for six months.	톰은 홀로 된지 6개월밖에 지나지 않았다.
2269	Tom suffers from chronic back pain.	톰은 만성 요통에 시달리고 있어.
1653	Is there something you want to say?	뭐 할 말이라도 있냐고.
3586	Please tell me when he arrives here.	그가 여기에 오면 저한테 말해주세요.
2572	There is no limit to human desire.	인간의 욕구는 끝이 없어.
1074	Tom wants to learn how to play piano.	톰은 피아노 치는 법을 배우고 싶어해.
1161	Silver is worth less than gold.	은이 금보다 가치가 낮아.
2875	I baked Tom a cake.	나는 톰에게 케이크를 구워줬다.
3680	What do you think of Tom's new car?	톰의 새로운 자동차에 대해 어떻게 생각해?
2689	I don't understand you.	선생님의 말씀은 이해가 안 됩니다.
2116	There are some important questions that science cannot answer.	과학이 답변할 수 없는 몇 가지 중요한 질문들이 있어.
351	Everybody wants permanent peace.	모두가 영원한 평화를 원한다.
3491	It's nothing I can't handle.	내가 감당할 수 있어.
3017	Have you ever seen Tom laugh?	톰이 웃은 걸 한번이라도 본 적 있어?
3308	Are these yours, Tom?	탐, 이것들이 너의 것이야?
361	I'm sorry I left without you.	너 빼고 가버려서 미안해.
1343	Do you know why I'm here?	내가 왜 여기있는지 알아?
3842	Tom learned to swim last summer.	톰은 지난 여름에 수영하는 법을 배웠어.
801	Which do you like better, meat or fish?	고기랑 생선 둘 중 뭐가 좋아?
3744	Tom says you're lonely.	톰이 말하길 네가 외로워한대.
2864	Why do we dream?	왜 우리는 꿈을 꿔?
3341	Will you help us now?	이제 우릴 도와줄 거야?
2031	Can you tell me more about the person you saw?	네가 본 사람에 대해 더 말해줄래?
1355	Feeling chilly, I turned on the heater.	한기를 느껴서 히터를 켰다.
1523	Do you know the name of the girl who was with Tom?	너 톰이랑 같이 있었던 여자애 이름 알아?
2845	That was the only way we could do that.	그게 우리가 할 수 있는 유일한 방법이었습니다.
2516	Bullying and teasing aren't allowed here.	따돌림과 괴롭힘은 이곳에선 허용되지 않아.
1748	Tom is allowed to stay. The rest of you have to leave.	톰은 남아 있어도 돼. 너희 나머지는 나가야 해.
3767	Who's the most intelligent person you know?	네가 아는 사람 중에서 누가 가장 머리가 좋은 사람이야?
1873	My father is suffering from influenza.	우리 아빠는 인플루엔자에 걸려 있어.
951	I take care of my grandfather.	나는 할아버지를 돌보고 있어.
598	They both speak French.	둘 다 프랑스어를 할 줄 알아.
3824	Tom has an addictive personality.	톰은 중독 성향이 있어.
875	This room is too dark.	이 방은 너무 어두워.
1140	Tom asked Mary to go home early.	톰이 메리한테 집에 일찍 가라고 부탁했어.
2879	There are many books in my room.	내 방에는 책이 정말 많아.
3514	That'll teach you a lesson.	그건 너한테 교훈을 줄 거야.
2720	Tom learns French as well.	톰도 마찬가지로 프랑스어 배워.
