	eng	rus
39171	Don't forget it.	Не забудь об этом.
35447	Let's go sledding.	Пойдём покатаемся на санках.
49997	Tom stole my idea.	Том украл у меня идею.
10486	I've got a plan.	У меня есть план.
46285	I don't like dogs.	Мне не нравятся собаки.
36420	He saved my life.	Он спас мне жизнь.
22001	Have you gone mad?	У тебя крыша поехала?
28890	I have a diploma.	У меня есть диплом.
18985	He stayed up late.	Он допоздна не ложился.
31256	Now listen to me.	А теперь послушайте меня.
1680	I don't mind.	Я ничего не имею против.
46644	I didn't hire Tom.	Я не брал Тома на работу.
36026	I'll be in town.	Я буду в городе.
9957	Tom won't hurt us.	Том не причинит нам вреда.
30056	I miss Tom a lot.	Я очень скучаю по Тому.
2794	You owe me money.	Вы должны мне деньги.
24341	Do what Tom asks.	Делайте, что Том просит.
31203	I can come, too.	Я тоже могу прийти.
38925	Do you have money?	У тебя деньги есть?
48410	I've just eaten.	Я только что поел.
10426	I miss Tom a lot.	Мне очень не хватает Тома.
13416	Isn't Tom hungry?	Том есть не хочет?
41235	Even I can sing.	Даже я умею петь.
45868	I don't deny it.	Я этого не отрицаю.
49513	I like modern art.	Мне нравится современное искусство.
2885	I love you both.	Я люблю вас обеих.
16468	I wasn't scared.	Я не был испуган.
13334	It couldn't wait.	Это не могло ждать.
4433	Its color is red.	Цвет у неё красный.
31073	I was very poor.	Я была очень бедна.
32776	I just had dinner.	Я только что поужинал.
40658	I like this part.	Мне нравится эта часть.
399	Tom must be angry.	Том, должно быть, зол.
32955	I didn't need you.	Вы мне не понадобились.
24680	I think I'm right.	Думаю, я прав.
7233	How do I fix that?	Как мне это починить?
17052	This was my idea.	Это была моя идея.
35439	I truly mean that.	Я искренне имею это в виду.
9301	This isn't my dog.	Это не моя собака.
33675	What'd I do?	Что бы я стал делать?
9802	I want you to go.	Я хочу, чтобы ты поехал.
31499	Come and see this.	Идите посмотрите на это.
25037	I won't ask.	Я не буду спрашивать.
45018	I'm bad at sports.	У меня не ладится со спортом.
43477	You saved us all.	Ты нас всех спас.
7708	That's what I did.	Я так и сделал.
27361	Was that too much?	Это было слишком много?
44023	I saw you smiling.	Я видел, как ты улыбалась.
18888	The ship set sail.	Корабль отправился в плавание.
9449	Tom was a bad boy.	Том был плохим мальчиком.
10174	Am I making sense?	Мои слова имеют смысл?
22092	I never saw you.	Я тебя никогда не видела.
2888	I said good night.	Я сказал, спокойной ночи.
7648	She may not come.	Она может не прийти.
24385	I hired Tom back.	Я снова взял Тома на работу.
34697	I can manage this.	Я могу справиться с этим.
17334	I must warn Tom.	Я должен предупредить Тома.
23799	That's not my job.	Это не моя работа.
16670	I can't go.	Я не смогу пойти.
11164	I didn't see them.	Я их не видел.
48681	I must see you.	Я должна увидеть тебя.
37929	You can't swim.	Вы не умеете плавать.
15185	I'm not your son.	Я не ваш сын.
40294	I called him Tom.	Я назвал его Томом.
20800	I didn't need it.	Она не была мне нужна.
34009	I won't go back.	Я не пойду обратно.
44100	May I put it here?	Можно я его сюда поставлю?
44614	Mom, I'm home.	Мам, я дома.
21779	Tom wouldn't eat.	Том не стал есть.
3796	I know I'm crazy.	Я знаю, что я сумасшедшая.
20220	She must go there.	Она должна туда поехать.
27890	I can find them.	Я могу найти их.
45540	I live with Tom.	Я живу с Томом.
38522	How could Tom win?	Как Том мог выиграть?
19723	Go say hi to Tom.	Пойди поздоровайся с Томом.
3320	May God bless you.	Да благословит вас Господь!
47730	I go to the park.	Я хожу в парк.
3487	Tom was too weak.	Том был слишком слаб.
9523	I couldn't refuse.	Я не мог отказать.
36016	That's old news.	Это я уже слышал.
11145	I had to see you.	Мне надо было вас увидеть.
38574	I'm all alone now.	Я теперь совсем один.
13	I hit on an idea.	Мне пришла в голову одна мысль.
35714	I'll ignore that.	Я не буду обращать на это внимания.
6144	Is your car black?	У тебя чёрная машина?
3834	I wouldn't care.	Мне было бы всё равно.
19464	I heard you, too.	Я тебя тоже слышал.
